{
  "name": "jerry",
  "version": "0.23.0",
  "description": "Framework for behavior and workflow guardrails with knowledge accrual",
  "author": {
    "name": "Jerry Framework Contributors",
    "url": "https://github.com/geekatron/jerry"
  },
  "license": "Apache-2.0",
  "repository": "https://github.com/geekatron/jerry",
  "keywords": [
    "jerry",
    "workflow",
    "guardrails",
    "knowledge-management",
    "problem-solving",
    "work-tracker",
    "hexagonal-architecture"
  ],
  "skills": "./skills/",
  "agents": [
    "./skills/adversary/agents/adv-executor.md",
    "./skills/adversary/agents/adv-scorer.md",
    "./skills/adversary/agents/adv-selector.md",
    "./skills/diataxis/agents/diataxis-auditor.md",
    "./skills/diataxis/agents/diataxis-classifier.md",
    "./skills/diataxis/agents/diataxis-explanation.md",
    "./skills/diataxis/agents/diataxis-howto.md",
    "./skills/diataxis/agents/diataxis-reference.md",
    "./skills/diataxis/agents/diataxis-tutorial.md",
    "./skills/eng-team/agents/eng-architect.md",
    "./skills/eng-team/agents/eng-backend.md",
    "./skills/eng-team/agents/eng-devsecops.md",
    "./skills/eng-team/agents/eng-frontend.md",
    "./skills/eng-team/agents/eng-incident.md",
    "./skills/eng-team/agents/eng-infra.md",
    "./skills/eng-team/agents/eng-lead.md",
    "./skills/eng-team/agents/eng-qa.md",
    "./skills/eng-team/agents/eng-reviewer.md",
    "./skills/eng-team/agents/eng-security.md",
    "./skills/nasa-se/agents/nse-architecture.md",
    "./skills/nasa-se/agents/nse-configuration.md",
    "./skills/nasa-se/agents/nse-explorer.md",
    "./skills/nasa-se/agents/nse-integration.md",
    "./skills/nasa-se/agents/nse-qa.md",
    "./skills/nasa-se/agents/nse-reporter.md",
    "./skills/nasa-se/agents/nse-requirements.md",
    "./skills/nasa-se/agents/nse-reviewer.md",
    "./skills/nasa-se/agents/nse-risk.md",
    "./skills/nasa-se/agents/nse-verification.md",
    "./skills/orchestration/agents/orch-planner.md",
    "./skills/orchestration/agents/orch-synthesizer.md",
    "./skills/orchestration/agents/orch-tracker.md",
    "./skills/problem-solving/agents/ps-analyst.md",
    "./skills/problem-solving/agents/ps-architect.md",
    "./skills/problem-solving/agents/ps-critic.md",
    "./skills/problem-solving/agents/ps-investigator.md",
    "./skills/problem-solving/agents/ps-reporter.md",
    "./skills/problem-solving/agents/ps-researcher.md",
    "./skills/problem-solving/agents/ps-reviewer.md",
    "./skills/problem-solving/agents/ps-synthesizer.md",
    "./skills/problem-solving/agents/ps-validator.md",
    "./skills/red-team/agents/red-exfil.md",
    "./skills/red-team/agents/red-exploit.md",
    "./skills/red-team/agents/red-infra.md",
    "./skills/red-team/agents/red-lateral.md",
    "./skills/red-team/agents/red-lead.md",
    "./skills/red-team/agents/red-persist.md",
    "./skills/red-team/agents/red-privesc.md",
    "./skills/red-team/agents/red-recon.md",
    "./skills/red-team/agents/red-reporter.md",
    "./skills/red-team/agents/red-social.md",
    "./skills/red-team/agents/red-vuln.md",
    "./skills/saucer-boy-framework-voice/agents/sb-calibrator.md",
    "./skills/saucer-boy-framework-voice/agents/sb-reviewer.md",
    "./skills/saucer-boy-framework-voice/agents/sb-rewriter.md",
    "./skills/saucer-boy/agents/sb-voice.md",
    "./skills/transcript/agents/ts-extractor.md",
    "./skills/transcript/agents/ts-formatter.md",
    "./skills/transcript/agents/ts-mindmap-ascii.md",
    "./skills/transcript/agents/ts-mindmap-mermaid.md",
    "./skills/transcript/agents/ts-parser.md",
    "./skills/worktracker/agents/wt-auditor.md",
    "./skills/worktracker/agents/wt-verifier.md",
    "./skills/worktracker/agents/wt-visualizer.md"
  ],
  "commands": [
    "./commands/architect.md",
    "./commands/release.md"
  ]
}
